137;I social Network sono:;Un servizio internet ;Un servizio telefonico;Un servizio SMS e MMS;Un servizio delle Poste Italiane;;;;
138;Indica i vantaggi della tecnologia VoIP:;Telefonare senza dover utilizzare la linea telefonica tradizionale  ;Navigare in internet senza costi;Telefonare ad altissimo costo;Inviare SMS senza costi;;;;
139;Il bancomat può essere utilizzato per:;prelevare contanti da uno sportello bancario ;fare acquisti rateali;prelevare soldi alla cassa di un supermercato;per pagare con assegni bancari;;;;
140;Che cosa indica la sigla BIOS?;Basic Input Output System  ;Basic Intranet Out System;Basic in Out System;Basic Input Output Software;;;;
141;Quanti Byte occorrono per scrivere la parola “gatto”?;5 Byte ;5 bit;50 bit;5 MB;;;;
142;Quanti bit occorrono per scrivere la parola “cane”?;32 bit ;64 bit;4 bit;40 bit;;;;
143;Una CPU è formata da:;ALU e CU ;BIOS e Firmware;GUI e VGA;CU e CPU;;;;
144;La RAM è più veloce di un Hard Disk:;Vero ;Falso;;;;;;
145;Quale unità di misura è utilizzata per definire le dimensioni di uno schermo;Pollici ;Piedi;Byte;Pixel;;;;
146;7 Byte corrispondono a:;56 bit ;72 bit;64 bit;32 bit;;;;
147;Indica quale tra le seguenti è una funzionalità del SO?;La gestione della GUI ;La creazione dei Siti Web;L’elaborazione di testi;La creazione di un database;;;;
148;L’acronimo di ROM è:;Read Only Memory ;Read Only Mater;Random Only Memory;Raster Only Master;;;;
149;Di quali parti è formato un PC?;Hardware ;Softwhere-;Freeware;Shareware;;;;
150;Chi è il programmatore?;Un esperto che scrive le istruzioni dei software che poi il computer dovrà eseguire ;Un tecnico che installa programmi sul PC;Un tecnico che risponde al telefono;Un tecnico che analizza e ripara il PC;;;;
151;La scheda di rete:;Può essere integrata nella scheda madre ;È collegata alla linea telefonica;È collegata alla porta seriale;È collegata alla linea telefonica;;;;
152;Un computer può inviare e ricevere Fax?;Si, ma è necessario disporre di una linea telefonica, un modem e un software adatto ;Si, ma è necessario disporre di un telefono;Si, ma è necessario disporre di una stampante;No, perché la linea telefonica è di tipo analogico;;;;
153;La rete telefonica è?;Una rete a commutazione di circuito ;Una rete a commutazione di pacchetti;Un software Open Source;Una rete che non usa protocolli;;;;